,AUC all features all assessments,AUC CV all features all assessments,AUC all features healthy controls all assessments,# of Positive Examples all assessments,AUC optimal features all assessments,Optimal # of features all assessments,# rows full dataset all assessments,# input features all assessments
Diag.Borderline Intellectual Functioning (test),0.848,0.855,0.912,259.0,0.825,21,1436,1067
Diag.Specific Learning Disorder with Impairment in Reading (test),0.848,0.841,0.835,189.0,0.854,15,1436,1067
Diag.Any Diag,0.769,0.84,0.769,1356.0,0.743,12,1436,1067
Diag.Specific Learning Disorder with Impairment in Written Expression (test),0.787,0.777,0.818,243.0,0.761,12,1436,1067
Diag.Processing Speed Deficit (test),0.742,0.751,0.879,356.0,0.754,21,1436,1067
Diag.NVLD (test),0.727,0.745,0.857,208.0,0.694,15,1436,1067
Diag.NVLD without reading condition (test),0.729,0.742,0.893,313.0,0.744,12,1436,1067
Diag.Specific Learning Disorder with Impairment in Mathematics (test),0.709,0.737,0.795,275.0,0.713,18,1436,1067
